[
  {
    "schema_version": "1.0.0",
    "decision_id": "ED-SCN-01-COMPLETE-001",
    "assessment_id": "SCN-01-COMPLETE",
    "question_id": "C4-Q01",
    "evidence_ids": [
      "EV-C4-001-context-register.txt"
    ],
    "deterministic_checks": [
      {
        "check_id": "CHK-C4-Q01-MAP",
        "check_type": "QUESTION_MAPPING_VALID",
        "status": "PASSED",
        "observation": "Evidence record is mapped to C4-Q01."
      },
      {
        "check_id": "CHK-C4-Q01-EVIDENCE",
        "check_type": "EVIDENCE_TYPE_VALID",
        "status": "PASSED",
        "observation": "Structured evidence references were supplied."
      }
    ],
    "semantic_observations": [],
    "decision": "EVIDENCED",
    "confidence": 1.0,
    "human_review_required": false,
    "provenance": {
      "created_at": "2026-09-04T08:00:00+00:00",
      "created_by": "agentic.evidence_assessor",
      "generator": "DETERMINISTIC_RULES",
      "generator_version": "0.2.0",
      "source_refs": [
        "assessment:SCN-01-COMPLETE",
        "question:C4-Q01"
      ]
    }
  },
  {
    "schema_version": "1.0.0",
    "decision_id": "ED-SCN-01-COMPLETE-002",
    "assessment_id": "SCN-01-COMPLETE",
    "question_id": "C4-Q02",
    "evidence_ids": [
      "EV-C4-002-interested-parties.txt"
    ],
    "deterministic_checks": [
      {
        "check_id": "CHK-C4-Q02-MAP",
        "check_type": "QUESTION_MAPPING_VALID",
        "status": "PASSED",
        "observation": "Evidence record is mapped to C4-Q02."
      },
      {
        "check_id": "CHK-C4-Q02-EVIDENCE",
        "check_type": "EVIDENCE_TYPE_VALID",
        "status": "PASSED",
        "observation": "Structured evidence references were supplied."
      }
    ],
    "semantic_observations": [],
    "decision": "EVIDENCED",
    "confidence": 1.0,
    "human_review_required": false,
    "provenance": {
      "created_at": "2026-09-04T08:00:00+00:00",
      "created_by": "agentic.evidence_assessor",
      "generator": "DETERMINISTIC_RULES",
      "generator_version": "0.2.0",
      "source_refs": [
        "assessment:SCN-01-COMPLETE",
        "question:C4-Q02"
      ]
    }
  },
  {
    "schema_version": "1.0.0",
    "decision_id": "ED-SCN-01-COMPLETE-003",
    "assessment_id": "SCN-01-COMPLETE",
    "question_id": "C4-Q03",
    "evidence_ids": [
      "EV-C4-003-aims-scope.txt"
    ],
    "deterministic_checks": [
      {
        "check_id": "CHK-C4-Q03-MAP",
        "check_type": "QUESTION_MAPPING_VALID",
        "status": "PASSED",
        "observation": "Evidence record is mapped to C4-Q03."
      },
      {
        "check_id": "CHK-C4-Q03-EVIDENCE",
        "check_type": "EVIDENCE_TYPE_VALID",
        "status": "PASSED",
        "observation": "Structured evidence references were supplied."
      }
    ],
    "semantic_observations": [],
    "decision": "EVIDENCED",
    "confidence": 1.0,
    "human_review_required": false,
    "provenance": {
      "created_at": "2026-09-04T08:00:00+00:00",
      "created_by": "agentic.evidence_assessor",
      "generator": "DETERMINISTIC_RULES",
      "generator_version": "0.2.0",
      "source_refs": [
        "assessment:SCN-01-COMPLETE",
        "question:C4-Q03"
      ]
    }
  },
  {
    "schema_version": "1.0.0",
    "decision_id": "ED-SCN-01-COMPLETE-004",
    "assessment_id": "SCN-01-COMPLETE",
    "question_id": "C4-Q04",
    "evidence_ids": [
      "EV-C4-004-process-map.txt"
    ],
    "deterministic_checks": [
      {
        "check_id": "CHK-C4-Q04-MAP",
        "check_type": "QUESTION_MAPPING_VALID",
        "status": "PASSED",
        "observation": "Evidence record is mapped to C4-Q04."
      },
      {
        "check_id": "CHK-C4-Q04-EVIDENCE",
        "check_type": "EVIDENCE_TYPE_VALID",
        "status": "PASSED",
        "observation": "Structured evidence references were supplied."
      }
    ],
    "semantic_observations": [],
    "decision": "EVIDENCED",
    "confidence": 1.0,
    "human_review_required": false,
    "provenance": {
      "created_at": "2026-09-04T08:00:00+00:00",
      "created_by": "agentic.evidence_assessor",
      "generator": "DETERMINISTIC_RULES",
      "generator_version": "0.2.0",
      "source_refs": [
        "assessment:SCN-01-COMPLETE",
        "question:C4-Q04"
      ]
    }
  }
]
