{
  "schema_version": "1.0.0",
  "decision_id": "ED-C4-Q02-001",
  "assessment_id": "URIELLE-C4-001",
  "question_id": "C4-Q02",
  "evidence_ids": [
    "EV-C4-002"
  ],
  "deterministic_checks": [
    {
      "check_id": "CHK-C4Q02-01",
      "check_type": "FILE_PRESENT",
      "status": "PASSED",
      "observation": "The referenced stakeholder register fixture is present."
    },
    {
      "check_id": "CHK-C4Q02-02",
      "check_type": "QUESTION_MAPPING_VALID",
      "status": "PASSED",
      "observation": "The evidence reference is mapped to question C4-Q02."
    }
  ],
  "semantic_observations": [],
  "decision": "EVIDENCED",
  "confidence": 1.0,
  "human_review_required": false,
  "provenance": {
    "created_at": "2026-07-21T08:05:00Z",
    "created_by": "Urielle-AI deterministic fixture",
    "generator": "DETERMINISTIC_RULES",
    "generator_version": "0.1.0",
    "source_refs": [
      "C4-Q02",
      "EV-C4-002"
    ]
  }
}
